{"contractVersion":"1.0.0","provenance":{"contractVersion":"1.0.0","subject":{"type":"repository","id":"specops-unity-reference-implementation","revision":{"scheme":"git-commit-sha1","identifier":"53595414f559d884d6d34ecafa7d350c1da96955"}},"executionId":"9581a4c9-6a5c-4e6f-9051-35c3ff256e79","producer":{"id":"specops-v2.0.1-release-evidence-materialization-process","version":"1.0.0"},"executedDefinition":{"type":"audit-definition","id":"specops-v2.0.1-patch-delta-audit","version":"1.0.0","reference":"procedures/specops-v2.0.1-patch-delta-audit.v1.json"},"governingContracts":[{"id":"audit-result.schema.json","version":"1.0.0","reference":".specops/contracts/audit-result.schema.json"},{"id":"evidence-provenance.schema.json","version":"1.0.0","reference":".specops/contracts/evidence-provenance.schema.json"}],"targetScope":[{"type":"patch-release-qualified-subject","id":"semver:2.0.1","reference":"git-commit-sha1:53595414f559d884d6d34ecafa7d350c1da96955"}],"executedAtUtc":"2026-08-30T06:36:20.3342357Z","limitations":["This is a bounded patch-delta audit. It does not materialize or validate the future v2.0.1 Release Container B."],"unresolvedUnknowns":[]},"overallResult":"PASS","findings":[{"id":"R3C-PATCH-DELTA","severity":"INFO","disposition":"RESOLVED","summary":"The qualified v2.0.1 subject is exactly the approved remediation delta above v2.0.0.","observations":["v2.0.0 peels to fdeb7126237894812c2f7fa77fad24ed4244a58c.","Qualified subject is 53595414f559d884d6d34ecafa7d350c1da96955 and contains exactly 2 commits above v2.0.0 Container B.","The net patch delta contains exactly six approved Bootstrap/projection-validator paths.","Runtime feature code, architecture authority, Packages, and ProjectSettings are unchanged.","Qualified Bootstrap Source Identity is 82df3aed63dc2ab32d5e641db7c8fac81b6924236e146bf0be59deb213c8abe9.","Producer worktree is clean and origin/specops-v2 is synchronized to the qualified subject."],"evidenceReferences":["procedures/specops-v2.0.1-patch-delta-audit.v1.json","validation-results/specops-v2.0.1-qualified-subject.validation-result.json"]},{"id":"R3C-REMEDIATION-ACCEPTANCE","severity":"INFO","disposition":"RESOLVED","summary":"The accepted remediation and fresh-consumer validation chain supports the qualified patch subject.","observations":["RMD-001 consumer authority/onboarding projection remediation passed.","RMD-T01 projection-validator PowerShell portability remediation passed and was independently verified without rg.","RMD-T01-RV1 and RV2 passed fresh no-rg preflight and exactly-one production Bootstrap validation.","RMD-T01-RV3-R1 completed 13/13 static acceptance checks.","RMD-T01-RV4 completed 8/8 Unity checks, 4/4 EditMode tests, and preserved 312/312 governed files.","R3A and R3B produced four candidate-bound production eval PASS results without consumer validation reruns."],"evidenceReferences":["procedures/specops-v2.0.1-release-validation-aggregation.v1.json","validation-results/specops-v2.0.1-qualified-subject.validation-result.json"]},{"id":"R3C-PENDING-CONTAINER-B","severity":"INFO","disposition":"UNRESOLVED","summary":"Release Container B, evidence finalization, v2.0.1 tag, GitHub Release, and main promotion remain pending later Human Authority gates.","observations":["No v2.0.1 Release Container B has been materialized.","The release manifest remains DRAFT.","No v2.0.1 tag has been created.","No v2.0.1 GitHub Release has been published.","main has not been promoted by R3."],"evidenceReferences":["procedures/specops-v2.0.1-patch-delta-audit.v1.json"]}]}
