{"contractVersion":"1.0.0","findings":[{"disposition":"RESOLVED","id":"I7-CONTAINER-B-BINDING","observations":["Container B is exactly fdeb7126237894812c2f7fa77fad24ed4244a58c and its only parent is A2 adddb2c91f7adae6133b384440d2c3f2020f1574.","The A2 to Container B delta contains exactly the twelve approved paths.","Container B records repository.releasedVersion as 2.0.0 and initialization.releaseEvidencePresent as true.","The committed Container B Bootstrap Source Identity is 93fd1d378c47b24265eafe35130ddb1879aa4c3470ac77aba41ffda4313603ed.","Active frozen Source Identity bindings are A2 0 and Container B 8."],"severity":"INFO","summary":"Committed Container B is bound as the reviewed v2.0.0 release container."},{"disposition":"RESOLVED","id":"I7-A2-QUALIFICATION-CONTINUITY","observations":["Production eval evidence continues to qualify A2 adddb2c91f7adae6133b384440d2c3f2020f1574.","Production eval evidence is neither rewritten nor re-subjected to Container B.","The release manifest qualifiedSubject remains A2; Container B is the reviewed release container around it."],"severity":"INFO","summary":"Qualified production-evidence subject remains A2."},{"disposition":"RESOLVED","id":"I7-I6-EVIDENCE-ACCEPTED","observations":["Projection 32/32 PASS; Core 230/230 PASS; Execution 143/143 PASS; Conformance 302/302 PASS.","The A2 and Container B projected path inventories are 312/312, with 311/311 non-provenance outputs exact-byte identical.","The only changed projected artifact is .specops/bootstrap.json and its only semantic delta is /sourceBaseline/sourceIdentity/digest.","Fresh-child releasedVersion is null and releaseEvidencePresent is false.","Unity-semantic projected-output delta is zero; Unity was NOT_REQUIRED.","Human Artifact Review passed."],"severity":"INFO","summary":"Closed I6 validation and Human Artifact Review evidence is accepted."},{"disposition":"RESOLVED","id":"I6-PROCEDURAL-001","observations":["The temporary validation-only Git repository/index was non-authoritative and provided deterministic git ls-files semantics.","The authoritative source repository and remotes were untouched by that infrastructure.","Human Authority changed the classification from BLOCKER to INFO and required no validation rerun."],"severity":"INFO","summary":"The I6 validation-only Git infrastructure deviation is accepted and dispositioned."},{"disposition":"RESOLVED","id":"I7-DURABLE-EVIDENCE-CONTINUITY","observations":["The durable initial evidence commit remains exactly deb92a9b89624ea21d05bbac6ad6c4b34ad213b0.","The existing six-member DRAFT release manifest FULL_JSON identity is b7233a14e6f43e02564c82fe0eba6c342d60734bbe1ce340e7da9339c7563602.","The new Container B binding audit extends evidence membership without modifying the six existing evidence-member objects."],"severity":"INFO","summary":"The immutable initial durable evidence root and six-member DRAFT continuity are established."},{"disposition":"UNRESOLVED","id":"I7-PENDING-PUBLICATION","observations":["The annotated v2.0.0 tag remains pending.","GitHub Release publication remains pending.","This audit does not authorize either action and does not claim release-manifest finalization."],"severity":"INFO","summary":"Annotated v2.0.0 tag creation and GitHub Release publication remain pending Human Authority action."}],"overallResult":"PASS","provenance":{"contractVersion":"1.0.0","executedAtUtc":"2026-08-29T13:27:51.732Z","executedDefinition":{"id":"specops-v2-container-b-binding-audit","reference":"procedures/specops-v2-container-b-binding-audit.v1.json","type":"audit-definition","version":"1.0.0"},"executionId":"71571401-d0a3-4ad0-aa43-d5d9aca71781","governingContracts":[{"id":"audit-result.schema.json","reference":".specops/contracts/audit-result.schema.json","version":"1.0.0"},{"id":"evidence-provenance.schema.json","reference":".specops/contracts/evidence-provenance.schema.json","version":"1.0.0"}],"limitations":["This audit binds the committed Container B release container to the previously qualified A2 evidence set and accepted I6 validation; it does not rerun production evals, Bootstrap validation suites, Unity, or H3."],"producer":{"id":"specops-v2-release-evidence-materialization-process","version":"1.0.0"},"subject":{"id":"specops-unity-reference-implementation","revision":{"identifier":"fdeb7126237894812c2f7fa77fad24ed4244a58c","scheme":"git-commit-sha1"},"type":"repository"},"targetScope":[{"id":"semver:2.0.0","reference":"git-commit-sha1:fdeb7126237894812c2f7fa77fad24ed4244a58c","type":"release-container-binding"},{"id":"specops-unity-reference-implementation","reference":"git-commit-sha1:adddb2c91f7adae6133b384440d2c3f2020f1574","type":"qualified-technical-subject"},{"id":"container-b","reference":"specops-bootstrap-source-jcs-sha256-v1:93fd1d378c47b24265eafe35130ddb1879aa4c3470ac77aba41ffda4313603ed","type":"bootstrap-source-identity"},{"id":"release-evidence/v2.0.0-staging","reference":"git-commit-sha1:deb92a9b89624ea21d05bbac6ad6c4b34ad213b0","type":"durable-evidence-root"}],"unresolvedUnknowns":[]}}