{"contractVersion":"1.0.0","findings":[{"disposition":"RESOLVED","evidenceReferences":["procedures/specops-v2-h3-a2-delta-audit.v1.json","validation-results/specops-v2.0.0-a2.validation-result.json"],"id":"H3-A2-CARRY-FORWARD","observations":["H3 passed against git-commit-sha1:63f656286daa2a13ec0a093084185c0ccca04a4e.","Candidate A2 differs from the H3 baseline through exactly the approved six-file projection contract repair.","No public release-facing documentation or governing authority changed.","No release lifecycle field changed; releasedVersion remains null and releaseEvidencePresent remains false.","No Packages or ProjectSettings path changed.","Provenance-aware projection equivalence established zero Unity-semantic output changes.","Required bounded A2 validation passed."],"severity":"INFO","summary":"H3 public-release-readiness closure remains applicable to committed candidate A2."},{"disposition":"UNRESOLVED","evidenceReferences":["procedures/specops-v2-h3-a2-delta-audit.v1.json"],"id":"I-PENDING-RELEASE-ACTIONS","observations":["This is intentional I-phase state and is not an H blocker.","No v2.0.0 tag currently exists.","This audit PASS does not itself approve publication."],"severity":"INFO","summary":"Release-manifest finalization, lifecycle container B, tag binding, asset publication and final Human Authority publication remain pending."}],"overallResult":"PASS","provenance":{"contractVersion":"1.0.0","executedAtUtc":"2026-08-29T09:27:58.4531956Z","executedDefinition":{"id":"specops-v2-h3-a2-delta-audit","reference":"procedures/specops-v2-h3-a2-delta-audit.v1.json","type":"audit-definition","version":"1.0.0"},"executionId":"31ec72e7-4f44-4278-ac54-ea841884dc46","governingContracts":[{"id":"audit-result.schema.json","reference":".specops/contracts/audit-result.schema.json","version":"1.0.0"},{"id":"evidence-provenance.schema.json","reference":".specops/contracts/evidence-provenance.schema.json","version":"1.0.0"}],"limitations":["This was a bounded H3-to-A2 delta audit, not a full H3 rerun."],"producer":{"id":"specops-v2-release-evidence-materialization-process","version":"1.0.0"},"subject":{"id":"specops-unity-reference-implementation","revision":{"identifier":"adddb2c91f7adae6133b384440d2c3f2020f1574","scheme":"git-commit-sha1"},"type":"repository"},"targetScope":[{"id":"specops-v2.0.0-h3-a2","type":"public-release-readiness-carry-forward"}],"unresolvedUnknowns":[]}}